{
  "name": "@company-simulator/root",
  "version": "0.1.0",
  "type": "app",
  "layer": "app",
  "exports": [],
  "dependencies": {},
  "health": {
    "maxPublicExports": 0,
    "maxCyclomaticComplexity": 12,
    "testCoverageRequired": 80
  },
  "owner": {
    "name": "architect",
    "reviewers": ["cto"],
    "stability": "stable"
  }
}
