{
  "name": "@company-simulator/analytics",
  "version": "0.1.0",
  "type": "feature",
  "layer": "feature",
  "exports": [],
  "dependencies": {
    "@company-simulator/types": ">=0.1.0",
    "@company-simulator/ports": ">=0.1.0",
    "@company-simulator/domain": ">=0.1.0"
  },
  "health": {
    "maxPublicExports": 15,
    "maxCyclomaticComplexity": 10,
    "testCoverageRequired": 80
  }
}
