{
  "name": "@company-simulator/domain",
  "version": "0.1.0",
  "type": "core",
  "layer": "core",
  "exports": [],
  "dependencies": {
    "@company-simulator/types": ">=0.1.0",
    "@company-simulator/utils": ">=0.1.0"
  },
  "health": {
    "maxPublicExports": 30,
    "maxCyclomaticComplexity": 12,
    "testCoverageRequired": 85
  }
}
