{
  "name": "@company-simulator/sim-run",
  "version": "0.1.0",
  "type": "feature",
  "layer": "feature",
  "exports": [],
  "dependencies": {
    "@company-simulator/types": ">=0.1.0",
    "@company-simulator/domain": ">=0.1.0",
    "@company-simulator/simulation": ">=0.1.0",
    "@company-simulator/engine": ">=0.1.0"
  },
  "health": {
    "maxPublicExports": 20,
    "maxCyclomaticComplexity": 12,
    "testCoverageRequired": 85
  }
}
